{
  "recipe_version": 3,
  "comparison_mode": "multiset",
  "scope": {"snapshot": "investigation-v1", "cutoff": "2026-10-09T00:00:00Z", "filters": [], "completeness": "full", "expected_empty": false},
  "columns": {"region": {"type": "string", "normalize": ["trim", "casefold"]}, "amount": {"type": "decimal", "scale": 2}},
  "column_mappings": {"region": {"baseline": "region", "candidate": "area"}},
  "output": {"sensitivity": "raw"}
}
